{
  "schemaVersion": "neo.agent-production-activation/v1",
  "evidenceClass": "template",
  "stage": "product_canary",
  "release": {
    "gitCommit": "0000000000000000000000000000000000000000",
    "migrationHead": 95,
    "runnerManifestSha256": "sha256:0000000000000000000000000000000000000000000000000000000000000000",
    "runnerBinarySha256": "sha256:0000000000000000000000000000000000000000000000000000000000000000",
    "operationsPolicySha256": "sha256:c0de501130af78fd621e595abc2f0424a946fe765a291971a116afb3e2533443"
  },
  "target": {
    "deploymentFingerprint": "sha256:0000000000000000000000000000000000000000000000000000000000000000",
    "runnerId": "neo-runner-primary"
  },
  "wiring": {
    "endpointSha256": "sha256:0000000000000000000000000000000000000000000000000000000000000000",
    "clientCertificateSha256": "sha256:0000000000000000000000000000000000000000000000000000000000000000",
    "serverCASha256": "sha256:0000000000000000000000000000000000000000000000000000000000000000",
    "serverName": "neo-runner.internal",
    "callerIdentity": "spiffe://neo-chat/agent-runtime-product-canary",
    "canaryPlanSha256": "sha256:0000000000000000000000000000000000000000000000000000000000000000",
    "authorityPublicKeySha256": "sha256:0000000000000000000000000000000000000000000000000000000000000000",
    "activationId": "activation_0000000000000001"
  },
  "prerequisites": {
    "controlPlane": "sha256:0000000000000000000000000000000000000000000000000000000000000000",
    "rootRun": "sha256:0000000000000000000000000000000000000000000000000000000000000000",
    "brokerArtifact": "sha256:0000000000000000000000000000000000000000000000000000000000000000",
    "projectMutation": "sha256:0000000000000000000000000000000000000000000000000000000000000000",
    "depthOneChild": "sha256:0000000000000000000000000000000000000000000000000000000000000000",
    "cronWorker": "sha256:0000000000000000000000000000000000000000000000000000000000000000",
    "draftLearning": "sha256:0000000000000000000000000000000000000000000000000000000000000000"
  },
  "window": {
    "startedAt": "2026-08-15T00:00:00Z",
    "completedAt": "2026-08-15T00:10:00Z",
    "expiresAt": "2026-08-16T00:00:00Z"
  },
  "checks": [
    {
      "id": "crash_restart_recovery",
      "result": "not_run",
      "observedAt": "2026-08-15T00:05:00Z",
      "evidenceSha256": "sha256:0000000000000000000000000000000000000000000000000000000000000000",
      "detailCode": "NOT_RUN"
    },
    {
      "id": "exact_host_isolation",
      "result": "isolation_unavailable",
      "observedAt": "2026-08-15T00:05:00Z",
      "evidenceSha256": "sha256:0000000000000000000000000000000000000000000000000000000000000000",
      "detailCode": "ISOLATION_UNAVAILABLE"
    },
    {
      "id": "fixed_plan_ready",
      "result": "not_run",
      "observedAt": "2026-08-15T00:05:00Z",
      "evidenceSha256": "sha256:0000000000000000000000000000000000000000000000000000000000000000",
      "detailCode": "NOT_RUN"
    },
    {
      "id": "prior_activation_chain",
      "result": "not_run",
      "observedAt": "2026-08-15T00:05:00Z",
      "evidenceSha256": "sha256:0000000000000000000000000000000000000000000000000000000000000000",
      "detailCode": "NOT_RUN"
    },
    {
      "id": "private_mtls_canary",
      "result": "not_run",
      "observedAt": "2026-08-15T00:05:00Z",
      "evidenceSha256": "sha256:0000000000000000000000000000000000000000000000000000000000000000",
      "detailCode": "NOT_RUN"
    },
    {
      "id": "product_request_authority",
      "result": "not_run",
      "observedAt": "2026-08-15T00:05:00Z",
      "evidenceSha256": "sha256:0000000000000000000000000000000000000000000000000000000000000000",
      "detailCode": "NOT_RUN"
    },
    {
      "id": "worker_least_privilege",
      "result": "not_run",
      "observedAt": "2026-08-15T00:05:00Z",
      "evidenceSha256": "sha256:0000000000000000000000000000000000000000000000000000000000000000",
      "detailCode": "NOT_RUN"
    },
    {
      "id": "zero_residue",
      "result": "not_run",
      "observedAt": "2026-08-15T00:05:00Z",
      "evidenceSha256": "sha256:0000000000000000000000000000000000000000000000000000000000000000",
      "detailCode": "NOT_RUN"
    }
  ],
  "authorization": {
    "productCanary": true,
    "genericRuntime": false,
    "brokerEffects": false,
    "delegation": false,
    "scheduler": false,
    "learning": false,
    "egress": false,
    "secrets": false
  },
  "cleanup": {
    "queuedRequests": 0,
    "claimedRequests": 0,
    "orphanSandboxes": 0,
    "scratchResidue": 0
  },
  "review": {
    "decision": "held",
    "reviewedAt": "2026-08-15T00:10:00Z",
    "reviewerFingerprint": "sha256:0000000000000000000000000000000000000000000000000000000000000000"
  }
}
